<?xml version="1.0" encoding="UTF-8"?>

<counts xmlns:xsi="http://www.w3.org/2001/XMLSchema-instance" xsi:noNamespaceSchemaLocation="http://matsim.org/files/dtd/counts_v1.xsd" 
		name="equilCounts" desc="counts values for equil net" 
		year="2008" layer="0">
	<!-- in a equilibrium state, there should be the same amount of vehicles
		 on the 9 alternative routes.  100 vehicles / 9 routes = 11.1 veh/route -->
	<count loc_id="11" cs_id="link_11">
		<volume h="1" val="0" />
		<volume h="2" val="0" />
		<volume h="3" val="0" />
		<volume h="4" val="0" />
		<volume h="5" val="0" />
		<volume h="6" val="0" />
		<volume h="7" val="0" />
		<volume h="8" val="0" />
		<volume h="9" val="0" />
		<volume h="10" val="0" />
		<volume h="11" val="0" />
		<volume h="12" val="0" />
		<volume h="13" val="0" />
		<volume h="14" val="0" />
		<volume h="15" val="0" />
		<volume h="16" val="0" />
		<volume h="17" val="0" />
		<volume h="18" val="0" />
		<volume h="19" val="0" />
		<volume h="20" val="0" />
		<volume h="21" val="0" />
		<volume h="22" val="0" />
		<volume h="23" val="0" />
		<volume h="24" val="0" />
	</count>
	<count loc_id="12" cs_id="link_12">
		<volume h="1" val="0" />
		<volume h="2" val="0" />
		<volume h="3" val="0" />
		<volume h="4" val="0" />
		<volume h="5" val="0" />
		<volume h="6" val="0" />
		<volume h="7" val="0" />
		<volume h="8" val="0" />
		<volume h="9" val="0" />
		<volume h="10" val="0" />
		<volume h="11" val="0" />
		<volume h="12" val="0" />
		<volume h="13" val="0" />
		<volume h="14" val="0" />
		<volume h="15" val="0" />
		<volume h="16" val="0" />
		<volume h="17" val="0" />
		<volume h="18" val="0" />
		<volume h="19" val="0" />
		<volume h="20" val="0" />
		<volume h="21" val="0" />
		<volume h="22" val="0" />
		<volume h="23" val="0" />
		<volume h="24" val="0" />
	</count>
	<count loc_id="13" cs_id="link_13">
		<volume h="1" val="0" />
		<volume h="2" val="0" />
		<volume h="3" val="0" />
		<volume h="4" val="0" />
		<volume h="5" val="0" />
		<volume h="6" val="0" />
		<volume h="7" val="0" />
		<volume h="8" val="0" />
		<volume h="9" val="0" />
		<volume h="10" val="0" />
		<volume h="11" val="0" />
		<volume h="12" val="0" />
		<volume h="13" val="0" />
		<volume h="14" val="0" />
		<volume h="15" val="0" />
		<volume h="16" val="0" />
		<volume h="17" val="0" />
		<volume h="18" val="0" />
		<volume h="19" val="0" />
		<volume h="20" val="0" />
		<volume h="21" val="0" />
		<volume h="22" val="0" />
		<volume h="23" val="0" />
		<volume h="24" val="0" />
	</count>
	<count loc_id="14" cs_id="link_14">
		<volume h="1" val="0" />
		<volume h="2" val="0" />
		<volume h="3" val="0" />
		<volume h="4" val="0" />
		<volume h="5" val="0" />
		<volume h="6" val="0" />
		<volume h="7" val="0" />
		<volume h="8" val="0" />
		<volume h="9" val="0" />
		<volume h="10" val="0" />
		<volume h="11" val="0" />
		<volume h="12" val="0" />
		<volume h="13" val="0" />
		<volume h="14" val="0" />
		<volume h="15" val="0" />
		<volume h="16" val="0" />
		<volume h="17" val="0" />
		<volume h="18" val="0" />
		<volume h="19" val="0" />
		<volume h="20" val="0" />
		<volume h="21" val="0" />
		<volume h="22" val="0" />
		<volume h="23" val="0" />
		<volume h="24" val="0" />
	</count>
	<count loc_id="15" cs_id="link_15">
		<volume h="1" val="0" />
		<volume h="2" val="0" />
		<volume h="3" val="0" />
		<volume h="4" val="0" />
		<volume h="5" val="0" />
		<volume h="6" val="0" />
		<volume h="7" val="0" />
		<volume h="8" val="0" />
		<volume h="9" val="0" />
		<volume h="10" val="0" />
		<volume h="11" val="0" />
		<volume h="12" val="0" />
		<volume h="13" val="0" />
		<volume h="14" val="0" />
		<volume h="15" val="0" />
		<volume h="16" val="0" />
		<volume h="17" val="0" />
		<volume h="18" val="0" />
		<volume h="19" val="0" />
		<volume h="20" val="0" />
		<volume h="21" val="0" />
		<volume h="22" val="0" />
		<volume h="23" val="0" />
		<volume h="24" val="0" />
	</count>
	<count loc_id="16" cs_id="link_16">
		<volume h="1" val="0" />
		<volume h="2" val="0" />
		<volume h="3" val="0" />
		<volume h="4" val="0" />
		<volume h="5" val="0" />
		<volume h="6" val="0" />
		<volume h="7" val="0" />
		<volume h="8" val="0" />
		<volume h="9" val="0" />
		<volume h="10" val="0" />
		<volume h="11" val="0" />
		<volume h="12" val="0" />
		<volume h="13" val="0" />
		<volume h="14" val="0" />
		<volume h="15" val="0" />
		<volume h="16" val="0" />
		<volume h="17" val="0" />
		<volume h="18" val="0" />
		<volume h="19" val="0" />
		<volume h="20" val="0" />
		<volume h="21" val="0" />
		<volume h="22" val="0" />
		<volume h="23" val="0" />
		<volume h="24" val="0" />
	</count>
	<count loc_id="17" cs_id="link_17">
		<volume h="1" val="0" />
		<volume h="2" val="0" />
		<volume h="3" val="0" />
		<volume h="4" val="0" />
		<volume h="5" val="0" />
		<volume h="6" val="0" />
		<volume h="7" val="0" />
		<volume h="8" val="0" />
		<volume h="9" val="0" />
		<volume h="10" val="0" />
		<volume h="11" val="0" />
		<volume h="12" val="0" />
		<volume h="13" val="0" />
		<volume h="14" val="0" />
		<volume h="15" val="0" />
		<volume h="16" val="0" />
		<volume h="17" val="0" />
		<volume h="18" val="0" />
		<volume h="19" val="0" />
		<volume h="20" val="0" />
		<volume h="21" val="0" />
		<volume h="22" val="0" />
		<volume h="23" val="0" />
		<volume h="24" val="0" />
	</count>
	<count loc_id="18" cs_id="link_18">
		<volume h="1" val="0" />
		<volume h="2" val="0" />
		<volume h="3" val="0" />
		<volume h="4" val="0" />
		<volume h="5" val="0" />
		<volume h="6" val="0" />
		<volume h="7" val="0" />
		<volume h="8" val="0" />
		<volume h="9" val="0" />
		<volume h="10" val="0" />
		<volume h="11" val="0" />
		<volume h="12" val="0" />
		<volume h="13" val="0" />
		<volume h="14" val="0" />
		<volume h="15" val="0" />
		<volume h="16" val="0" />
		<volume h="17" val="0" />
		<volume h="18" val="0" />
		<volume h="19" val="0" />
		<volume h="20" val="0" />
		<volume h="21" val="0" />
		<volume h="22" val="0" />
		<volume h="23" val="0" />
		<volume h="24" val="0" />
	</count>
	<count loc_id="19" cs_id="link_19">
		<volume h="1" val="0" />
		<volume h="2" val="0" />
		<volume h="3" val="0" />
		<volume h="4" val="0" />
		<volume h="5" val="0" />
		<volume h="6" val="0" />
		<volume h="7" val="5" />
		<volume h="8" val="0" />
		<volume h="9" val="0" />
		<volume h="10" val="0" />
		<volume h="11" val="0" />
		<volume h="12" val="0" />
		<volume h="13" val="0" />
		<volume h="14" val="0" />
		<volume h="15" val="0" />
		<volume h="16" val="0" />
		<volume h="17" val="0" />
		<volume h="18" val="0" />
		<volume h="19" val="0" />
		<volume h="20" val="0" />
		<volume h="21" val="0" />
		<volume h="22" val="0" />
		<volume h="23" val="0" />
		<volume h="24" val="0" />
	</count>
	<count loc_id="21" cs_id="link_21">
		<volume h="1" val="0" />
		<volume h="2" val="0" />
		<volume h="3" val="0" />
		<volume h="4" val="0" />
		<volume h="5" val="0" />
		<volume h="6" val="0" />
		<volume h="7" val="5" />
		<volume h="8" val="0" />
		<volume h="9" val="0" />
		<volume h="10" val="0" />
		<volume h="11" val="0" />
		<volume h="12" val="0" />
		<volume h="13" val="0" />
		<volume h="14" val="0" />
		<volume h="15" val="0" />
		<volume h="16" val="0" />
		<volume h="17" val="0" />
		<volume h="18" val="0" />
		<volume h="19" val="0" />
		<volume h="20" val="0" />
		<volume h="21" val="0" />
		<volume h="22" val="0" />
		<volume h="23" val="0" />
		<volume h="24" val="0" />
	</count>
</counts>